{
  "schema": "ttk.map-result.v2",
  "packet_id": "map-window-0018",
  "packet_sha256": "f2b62c9f1af2a123f82e2f583734ff023ba7620b4da8dda200e11ef87f0759fc",
  "window_id": "window-0018",
  "subtopics": [
    {
      "label": "Window window-0018 Topics",
      "source_segment_ids": [
        "seg-001067",
        "seg-001068",
        "seg-001069",
        "seg-001070",
        "seg-001071",
        "seg-001072",
        "seg-001073",
        "seg-001074",
        "seg-001075",
        "seg-001076",
        "seg-001077",
        "seg-001078",
        "seg-001079",
        "seg-001080",
        "seg-001081",
        "seg-001082",
        "seg-001083",
        "seg-001084",
        "seg-001085",
        "seg-001086",
        "seg-001087",
        "seg-001088",
        "seg-001089",
        "seg-001090",
        "seg-001091",
        "seg-001092",
        "seg-001093",
        "seg-001094",
        "seg-001095",
        "seg-001096",
        "seg-001097",
        "seg-001098",
        "seg-001099",
        "seg-001100",
        "seg-001101",
        "seg-001102",
        "seg-001103",
        "seg-001104",
        "seg-001105",
        "seg-001106",
        "seg-001107",
        "seg-001108",
        "seg-001109",
        "seg-001110",
        "seg-001111",
        "seg-001112",
        "seg-001113",
        "seg-001114",
        "seg-001115",
        "seg-001116",
        "seg-001117",
        "seg-001118",
        "seg-001119",
        "seg-001120"
      ]
    }
  ],
  "key_points": [
    {
      "text": "kids who have autism of the sort that we're describing and the need we're told to train them to",
      "source_segment_ids": [
        "seg-001067"
      ]
    },
    {
      "text": "make eye contact and read faces so this lands square in your work maybe you could just fill out",
      "source_segment_ids": [
        "seg-001068"
      ]
    },
    {
      "text": "a bit of what's now known what's thought what's not known it's a great topic I mean the way that",
      "source_segment_ids": [
        "seg-001069"
      ]
    }
  ],
  "mechanisms": [],
  "protocols": [],
  "arguments": [],
  "candidate_claims": [
    {
      "claim_text": "kids who have autism of the sort that we're describing and the need we're told to train them to",
      "claim_kind": "fact",
      "speaker": null,
      "source_segment_ids": [
        "seg-001067"
      ],
      "quote_evidence": [
        {
          "segment_id": "seg-001067",
          "quote": "kids who have autism of the sort that we're describing and the need we're told to train them to"
        }
      ],
      "checkworthiness": "medium"
    },
    {
      "claim_text": "make eye contact and read faces so this lands square in your work maybe you could just fill out",
      "claim_kind": "fact",
      "speaker": null,
      "source_segment_ids": [
        "seg-001068"
      ],
      "quote_evidence": [
        {
          "segment_id": "seg-001068",
          "quote": "make eye contact and read faces so this lands square in your work maybe you could just fill out"
        }
      ],
      "checkworthiness": "low"
    },
    {
      "claim_text": "a bit of what's now known what's thought what's not known it's a great topic I mean the way that",
      "claim_kind": "fact",
      "speaker": null,
      "source_segment_ids": [
        "seg-001069"
      ],
      "quote_evidence": [
        {
          "segment_id": "seg-001069",
          "quote": "a bit of what's now known what's thought what's not known it's a great topic I mean the way that"
        }
      ],
      "checkworthiness": "low"
    }
  ],
  "entities": [],
  "concepts": [],
  "open_questions": [],
  "contradictions_or_uncertainty": []
}
