{
  "schema": "ttk.map-result.v2",
  "packet_id": "map-window-0006",
  "packet_sha256": "72442303fe24bb055397f509785b01a4fffb07d65e6572f1626009d0573a8953",
  "window_id": "window-0006",
  "subtopics": [
    {
      "label": "Thematischer Abschnitt: so this is how we combine that and then even looking at different asset classes",
      "source_segment_ids": [
        "seg-000124",
        "seg-000125",
        "seg-000126",
        "seg-000127",
        "seg-000128",
        "seg-000129",
        "seg-000130",
        "seg-000131",
        "seg-000132",
        "seg-000133"
      ]
    },
    {
      "label": "Thematischer Abschnitt: I took a little bit more time in the beginning to reveal or to repeat the proced",
      "source_segment_ids": [
        "seg-000134",
        "seg-000135",
        "seg-000136",
        "seg-000137",
        "seg-000138",
        "seg-000139",
        "seg-000140",
        "seg-000141",
        "seg-000142",
        "seg-000143"
      ]
    },
    {
      "label": "Thematischer Abschnitt: I would not take care if future turning points more far in the future will chang",
      "source_segment_ids": [
        "seg-000144",
        "seg-000145",
        "seg-000146",
        "seg-000147",
        "seg-000148",
        "seg-000149",
        "seg-000150",
        "seg-000151",
        "seg-000152",
        "seg-000153"
      ]
    },
    {
      "label": "Thematischer Abschnitt: when the 341 and to 44 cycles in civil synchronized does this mean that the enve",
      "source_segment_ids": [
        "seg-000154"
      ]
    }
  ],
  "key_points": [
    {
      "text": "so this is how we combine that and then even looking at different asset classes so Uranium and last but not least I mean we have those...",
      "source_segment_ids": [
        "seg-000124"
      ]
    },
    {
      "text": "the oil futures again here I mean I don't want to reveal or go go too much into the past but and I discuss this here with a lot of colleagues so...",
      "source_segment_ids": [
        "seg-000125"
      ]
    },
    {
      "text": "even before we had the crisis with the showing up here was an indication at 60 at that point in time early 2021 that we would like to expect now...",
      "source_segment_ids": [
        "seg-000126"
      ]
    },
    {
      "text": "so you could argue for sure I mean it was induced by the war but if those events happen in the direction of the underlying dominant cyclic trend...",
      "source_segment_ids": [
        "seg-000128"
      ]
    },
    {
      "text": "and I mean believe me or not but that cycle showed up even before everything started and we now have completed the downward phase of that cyclic...",
      "source_segment_ids": [
        "seg-000130"
      ]
    },
    {
      "text": "you could assume in which direction the acceleration of price would be expected during that phase until October year",
      "source_segment_ids": [
        "seg-000132"
      ]
    }
  ],
  "mechanisms": [],
  "protocols": [],
  "arguments": [],
  "candidate_claims": [
    {
      "claim_text": "so this is how we combine that and then even looking at different asset classes so Uranium and last but not least I mean we have those geopolitical crisis around the world what's going on with the oil price what do time cycles tell us on oil here we have the oil price",
      "claim_kind": "fact",
      "speaker": null,
      "checkworthiness": "high",
      "source_segment_ids": [
        "seg-000124"
      ],
      "quote_evidence": [
        {
          "segment_id": "seg-000124",
          "quote": "so this is how we combine that and then even looking at different asset classes so Uranium and last but not least I mean we have those geopolitical crisis around the world what's going on with the oil price what do time cycles tell us on oil here we have the oil price"
        }
      ]
    },
    {
      "claim_text": "the oil futures again here I mean I don't want to reveal or go go too much into the past but and I discuss this here with a lot of colleagues so the upcoming bottom in the oil price early 2026",
      "claim_kind": "fact",
      "speaker": null,
      "checkworthiness": "high",
      "source_segment_ids": [
        "seg-000125"
      ],
      "quote_evidence": [
        {
          "segment_id": "seg-000125",
          "quote": "the oil futures again here I mean I don't want to reveal or go go too much into the past but and I discuss this here with a lot of colleagues so the upcoming bottom in the oil price early 2026"
        }
      ]
    },
    {
      "claim_text": "even before we had the crisis with the showing up here was an indication at 60 at that point in time early 2021 that we would like to expect now a positive cyclic upswing synchronization of two important cycles here",
      "claim_kind": "fact",
      "speaker": null,
      "checkworthiness": "high",
      "source_segment_ids": [
        "seg-000126"
      ],
      "quote_evidence": [
        {
          "segment_id": "seg-000126",
          "quote": "even before we had the crisis with the showing up here was an indication at 60 at that point in time early 2021 that we would like to expect now a positive cyclic upswing synchronization of two important cycles here"
        }
      ]
    },
    {
      "claim_text": "this was then accelerated by the geopolitical crisis and the war which started then in March April this pushed and this was an event in the direction of the dominant cycle",
      "claim_kind": "fact",
      "speaker": null,
      "checkworthiness": "high",
      "source_segment_ids": [
        "seg-000127"
      ],
      "quote_evidence": [
        {
          "segment_id": "seg-000127",
          "quote": "this was then accelerated by the geopolitical crisis and the war which started then in March April this pushed and this was an event in the direction of the dominant cycle"
        }
      ]
    },
    {
      "claim_text": "so you could argue for sure I mean it was induced by the war but if those events happen in the direction of the underlying dominant cyclic trend so the tailwind was positive since early 2026 on the oil price",
      "claim_kind": "fact",
      "speaker": null,
      "checkworthiness": "high",
      "source_segment_ids": [
        "seg-000128"
      ],
      "quote_evidence": [
        {
          "segment_id": "seg-000128",
          "quote": "so you could argue for sure I mean it was induced by the war but if those events happen in the direction of the underlying dominant cyclic trend so the tailwind was positive since early 2026 on the oil price"
        }
      ]
    },
    {
      "claim_text": "so then this accelerates the the price in that direction the I mean you could argue the geopolitical tension softened here in May so the conflict was trying to but it was the same from the cyclic perspective so here again we have a running on way rails situation",
      "claim_kind": "fact",
      "speaker": null,
      "checkworthiness": "high",
      "source_segment_ids": [
        "seg-000129"
      ],
      "quote_evidence": [
        {
          "segment_id": "seg-000129",
          "quote": "so then this accelerates the the price in that direction the I mean you could argue the geopolitical tension softened here in May so the conflict was trying to but it was the same from the cyclic perspective so here again we have a running on way rails situation"
        }
      ]
    }
  ],
  "entities": [
    {
      "name": "Uranium",
      "type": "domain_entity",
      "description": "Named domain entity 'Uranium' identified in source",
      "source_segment_ids": [
        "seg-000124"
      ]
    },
    {
      "name": "March April",
      "type": "domain_entity",
      "description": "Named domain entity 'March April' identified in source",
      "source_segment_ids": [
        "seg-000127"
      ]
    },
    {
      "name": "May",
      "type": "domain_entity",
      "description": "Named domain entity 'May' identified in source",
      "source_segment_ids": [
        "seg-000129"
      ]
    },
    {
      "name": "April",
      "type": "domain_entity",
      "description": "Named domain entity 'April' identified in source",
      "source_segment_ids": [
        "seg-000130"
      ]
    }
  ],
  "concepts": [
    {
      "name": "Fibonacci Ratio Relationships",
      "type": "domain_concept",
      "description": "Mathematical proportions governing wave amplitude and retracement targets",
      "source_segment_ids": [
        "seg-000124"
      ]
    }
  ],
  "open_questions": [],
  "contradictions_or_uncertainty": [
    {
      "text": "then making a decision to pick a cycle not so that's why we're here as the foundation for the study of cycles so we want to give you the tools to make it as easy as possible as reliable as possible but however those tools are not there to trade or make you successful in trading this then that competence belongs to you to make use of that information for your individual risk management trade management decision management",
      "source_segment_ids": [
        "seg-000137"
      ]
    },
    {
      "text": "and whatever there's much more in being successful in financial markets than just cycle analysis that's just one part of the picture yeah not sure if I was too quick today I just rushed through it so I see you all in the chat so moin moin",
      "source_segment_ids": [
        "seg-000138"
      ]
    }
  ]
}
