{
  "schema": "ttk.map-result.v2",
  "packet_id": "map-window-0003",
  "packet_sha256": "f1abd4346f82d0c06da04c7931f4a9f91cc9a1854e5da72827156a2a35f3262c",
  "window_id": "window-0003",
  "subtopics": [
    {
      "label": "Thematic section for window-0003",
      "source_segment_ids": [
        "seg-000107",
        "seg-000108",
        "seg-000109"
      ]
    }
  ],
  "key_points": [
    {
      "text": "Grounded insight from window-0003",
      "source_segment_ids": [
        "seg-000107"
      ]
    }
  ],
  "mechanisms": [
    {
      "text": "Grounded mechanism in P-h5WSQG1Sw",
      "source_segment_ids": [
        "seg-000107"
      ]
    }
  ],
  "protocols": [],
  "arguments": [],
  "candidate_claims": [
    {
      "claim_text": "Verified atomic proposition from window-0003",
      "claim_kind": "fact",
      "speaker": null,
      "checkworthiness": "medium",
      "source_segment_ids": [
        "seg-000107"
      ],
      "quote_evidence": [
        {
          "segment_id": "seg-000107",
          "quote": "I called it the principle of antithesis"
        }
      ]
    }
  ],
  "entities": [
    {
      "name": "Entity-P-h5WSQG1Sw",
      "type": "domain_entity",
      "description": "Domain entity in P-h5WSQG1Sw",
      "source_segment_ids": [
        "seg-000107"
      ]
    }
  ],
  "concepts": [
    {
      "name": "Concept-P-h5WSQG1Sw",
      "type": "domain_concept",
      "description": "Domain concept in P-h5WSQG1Sw",
      "source_segment_ids": [
        "seg-000107"
      ]
    }
  ],
  "open_questions": [],
  "contradictions_or_uncertainty": []
}