{
  "schema": "ttk.map-result.v2",
  "packet_id": "map-window-0001",
  "packet_sha256": "956a38107453d746f71df2b7825e19c20b7e08a42434e87cca93d480f4c3f75b",
  "window_id": "window-0001",
  "subtopics": [
    {
      "label": "Thematischer Abschnitt: Elliott, thanks for joining us today, so we have Elliott Pregnant with us, and i",
      "source_segment_ids": [
        "seg-000001",
        "seg-000002",
        "seg-000003",
        "seg-000004",
        "seg-000005",
        "seg-000006",
        "seg-000007",
        "seg-000008",
        "seg-000009",
        "seg-000010",
        "seg-000011",
        "seg-000012",
        "seg-000013",
        "seg-000014"
      ]
    },
    {
      "label": "Thematischer Abschnitt: every day pouring over market charts and he kept noticing these recurring patter",
      "source_segment_ids": [
        "seg-000015",
        "seg-000016",
        "seg-000017",
        "seg-000018",
        "seg-000019",
        "seg-000020",
        "seg-000021",
        "seg-000022",
        "seg-000023",
        "seg-000024",
        "seg-000025",
        "seg-000026",
        "seg-000027",
        "seg-000028"
      ]
    },
    {
      "label": "Thematischer Abschnitt: I think that was the worst, I think it's the worst inflationary period in US his",
      "source_segment_ids": [
        "seg-000029",
        "seg-000030",
        "seg-000031",
        "seg-000032",
        "seg-000033",
        "seg-000034",
        "seg-000035",
        "seg-000036",
        "seg-000037",
        "seg-000038",
        "seg-000039",
        "seg-000040",
        "seg-000041",
        "seg-000042"
      ]
    },
    {
      "label": "Thematischer Abschnitt: banks right now.",
      "source_segment_ids": [
        "seg-000043",
        "seg-000044"
      ]
    }
  ],
  "key_points": [
    {
      "text": "Elliott, thanks for joining us today, so we have Elliott Pregnant with us, and it's an honor to",
      "source_segment_ids": [
        "seg-000001"
      ]
    },
    {
      "text": "have you here spending some time with us talking about the Elliott Wave Principle and your history",
      "source_segment_ids": [
        "seg-000002"
      ]
    },
    {
      "text": "and your personal background on that.",
      "source_segment_ids": [
        "seg-000003"
      ]
    },
    {
      "text": "So, I mean, before we go into the more depth of Elliott Wave,",
      "source_segment_ids": [
        "seg-000003"
      ]
    },
    {
      "text": "Well, okay, I think the simplest way to understand it is it's a description of the price patterns",
      "source_segment_ids": [
        "seg-000005"
      ]
    },
    {
      "text": "of these price patterns.",
      "source_segment_ids": [
        "seg-000007"
      ]
    }
  ],
  "mechanisms": [],
  "protocols": [],
  "arguments": [
    {
      "text": "of these price patterns.",
      "source_segment_ids": [
        "seg-000007"
      ]
    },
    {
      "text": "So, you could imagine that understanding the way these patterns behave",
      "source_segment_ids": [
        "seg-000007"
      ]
    },
    {
      "text": "every day pouring over market charts and he kept noticing these recurring patterns in price and time",
      "source_segment_ids": [
        "seg-000015"
      ]
    },
    {
      "text": "It was more of a visceral feeling of wow these cycles in the market they",
      "source_segment_ids": [
        "seg-000040"
      ]
    }
  ],
  "candidate_claims": [
    {
      "claim_text": "Elliott, thanks for joining us today, so we have Elliott Pregnant with us, and it's an honor to",
      "claim_kind": "fact",
      "speaker": null,
      "checkworthiness": "high",
      "source_segment_ids": [
        "seg-000001"
      ],
      "quote_evidence": [
        {
          "segment_id": "seg-000001",
          "quote": "Elliott, thanks for joining us today, so we have Elliott Pregnant with us, and it's an honor to"
        }
      ]
    },
    {
      "claim_text": "have you here spending some time with us talking about the Elliott Wave Principle and your history",
      "claim_kind": "fact",
      "speaker": null,
      "checkworthiness": "high",
      "source_segment_ids": [
        "seg-000002"
      ],
      "quote_evidence": [
        {
          "segment_id": "seg-000002",
          "quote": "have you here spending some time with us talking about the Elliott Wave Principle and your history"
        }
      ]
    },
    {
      "claim_text": "and your personal background on that.",
      "claim_kind": "fact",
      "speaker": null,
      "checkworthiness": "high",
      "source_segment_ids": [
        "seg-000003"
      ],
      "quote_evidence": [
        {
          "segment_id": "seg-000003",
          "quote": "and your personal background on that."
        }
      ]
    },
    {
      "claim_text": "So, I mean, before we go into the more depth of Elliott Wave,",
      "claim_kind": "fact",
      "speaker": null,
      "checkworthiness": "high",
      "source_segment_ids": [
        "seg-000003"
      ],
      "quote_evidence": [
        {
          "segment_id": "seg-000003",
          "quote": "So, I mean, before we go into the more depth of Elliott Wave,"
        }
      ]
    },
    {
      "claim_text": "if someone would be new to that kind of analysis, how would you describe Elliott Wave in simple sentences?",
      "claim_kind": "fact",
      "speaker": null,
      "checkworthiness": "high",
      "source_segment_ids": [
        "seg-000004"
      ],
      "quote_evidence": [
        {
          "segment_id": "seg-000004",
          "quote": "if someone would be new to that kind of analysis, how would you describe Elliott Wave in simple sentences?"
        }
      ]
    },
    {
      "claim_text": "Well, okay, I think the simplest way to understand it is it's a description of the price patterns",
      "claim_kind": "fact",
      "speaker": null,
      "checkworthiness": "high",
      "source_segment_ids": [
        "seg-000005"
      ],
      "quote_evidence": [
        {
          "segment_id": "seg-000005",
          "quote": "Well, okay, I think the simplest way to understand it is it's a description of the price patterns"
        }
      ]
    }
  ],
  "entities": [
    {
      "name": "Elliott",
      "type": "market_theorist_or_framework",
      "description": "Key entity in Elliott Wave principle (Elliott)",
      "source_segment_ids": [
        "seg-000034"
      ]
    },
    {
      "name": "Elliott Pregnant",
      "type": "domain_entity",
      "description": "Named domain entity 'Elliott Pregnant' identified in source",
      "source_segment_ids": [
        "seg-000001"
      ]
    },
    {
      "name": "Elliott Wave Principle",
      "type": "domain_entity",
      "description": "Named domain entity 'Elliott Wave Principle' identified in source",
      "source_segment_ids": [
        "seg-000002"
      ]
    },
    {
      "name": "Elliott Wave",
      "type": "domain_entity",
      "description": "Named domain entity 'Elliott Wave' identified in source",
      "source_segment_ids": [
        "seg-000003"
      ]
    },
    {
      "name": "Wall Street",
      "type": "market_institution_or_actor",
      "description": "Finanzmarkt- und geopolitische Entität (Wall Street)",
      "source_segment_ids": [
        "seg-000025"
      ]
    }
  ],
  "concepts": [
    {
      "name": "Functional Emotion Theory",
      "type": "domain_concept",
      "description": "Conceptual framework defining emotions as evolved coordinating central states",
      "source_segment_ids": [
        "seg-000001"
      ]
    }
  ],
  "open_questions": [
    {
      "text": "if someone would be new to that kind of analysis, how would you describe Elliott Wave in simple sentences?",
      "source_segment_ids": [
        "seg-000004"
      ]
    },
    {
      "text": "Elliott Wave theory was developed, can you give us a bit of the backdrop?",
      "source_segment_ids": [
        "seg-000009"
      ]
    }
  ],
  "contradictions_or_uncertainty": []
}
