{
  "schema": "ttk.map-result.v2",
  "packet_id": "map-window-0003",
  "packet_sha256": "f60d7d49a5959041043096eee6731a56b37dee0a3e5cf6123a0eaa002a068511",
  "window_id": "window-0003",
  "subtopics": [
    {
      "label": "Window window-0003 Topics",
      "source_segment_ids": [
        "seg-000117",
        "seg-000118",
        "seg-000119",
        "seg-000120",
        "seg-000121",
        "seg-000122",
        "seg-000123",
        "seg-000124",
        "seg-000125",
        "seg-000126",
        "seg-000127",
        "seg-000128",
        "seg-000129",
        "seg-000130",
        "seg-000131",
        "seg-000132",
        "seg-000133",
        "seg-000134",
        "seg-000135",
        "seg-000136",
        "seg-000137",
        "seg-000138",
        "seg-000139",
        "seg-000140",
        "seg-000141",
        "seg-000142",
        "seg-000143",
        "seg-000144",
        "seg-000145",
        "seg-000146",
        "seg-000147",
        "seg-000148",
        "seg-000149",
        "seg-000150",
        "seg-000151",
        "seg-000152",
        "seg-000153",
        "seg-000154",
        "seg-000155",
        "seg-000156",
        "seg-000157",
        "seg-000158",
        "seg-000159",
        "seg-000160",
        "seg-000161"
      ]
    }
  ],
  "key_points": [
    {
      "text": "yes I mean e-waves does do the wave count it's an automated process so you don't have to sit there by",
      "source_segment_ids": [
        "seg-000117"
      ]
    },
    {
      "text": "hand and sketch out the wave pattern which like you said earlier can be very tricky because when",
      "source_segment_ids": [
        "seg-000118"
      ]
    },
    {
      "text": "you're looking at a chart through you're going to have partial patterns most of the time and that's",
      "source_segment_ids": [
        "seg-000119"
      ]
    }
  ],
  "mechanisms": [],
  "protocols": [],
  "arguments": [],
  "candidate_claims": [
    {
      "claim_text": "yes I mean e-waves does do the wave count it's an automated process so you don't have to sit there by",
      "claim_kind": "fact",
      "speaker": null,
      "source_segment_ids": [
        "seg-000117"
      ],
      "quote_evidence": [
        {
          "segment_id": "seg-000117",
          "quote": "yes I mean e-waves does do the wave count it's an automated process so you don't have to sit there by"
        }
      ],
      "checkworthiness": "medium"
    },
    {
      "claim_text": "hand and sketch out the wave pattern which like you said earlier can be very tricky because when",
      "claim_kind": "fact",
      "speaker": null,
      "source_segment_ids": [
        "seg-000118"
      ],
      "quote_evidence": [
        {
          "segment_id": "seg-000118",
          "quote": "hand and sketch out the wave pattern which like you said earlier can be very tricky because when"
        }
      ],
      "checkworthiness": "low"
    },
    {
      "claim_text": "you're looking at a chart through you're going to have partial patterns most of the time and that's",
      "claim_kind": "fact",
      "speaker": null,
      "source_segment_ids": [
        "seg-000119"
      ],
      "quote_evidence": [
        {
          "segment_id": "seg-000119",
          "quote": "you're looking at a chart through you're going to have partial patterns most of the time and that's"
        }
      ],
      "checkworthiness": "low"
    }
  ],
  "entities": [],
  "concepts": [],
  "open_questions": [],
  "contradictions_or_uncertainty": []
}
