{
  "schema": "ttk.map-result.v2",
  "packet_id": "map-window-0001",
  "packet_sha256": "d5f4f9fbaf2ad7f6858015f1b65de35d65c7cfac7c99bc58e78d1589d0ef2baa",
  "window_id": "window-0001",
  "subtopics": [
    {
      "label": "Thematic section for window-0001",
      "source_segment_ids": [
        "seg-000001",
        "seg-000002",
        "seg-000003"
      ]
    }
  ],
  "key_points": [
    {
      "text": "Grounded insight from window-0001",
      "source_segment_ids": [
        "seg-000001"
      ]
    }
  ],
  "mechanisms": [
    {
      "text": "Grounded mechanism in oZIsMX6WgFs",
      "source_segment_ids": [
        "seg-000001"
      ]
    }
  ],
  "protocols": [],
  "arguments": [],
  "candidate_claims": [
    {
      "claim_text": "Verified atomic proposition from window-0001",
      "claim_kind": "fact",
      "speaker": null,
      "checkworthiness": "medium",
      "source_segment_ids": [
        "seg-000001"
      ],
      "quote_evidence": [
        {
          "segment_id": "seg-000001",
          "quote": "Hello, cycle nerds"
        }
      ]
    }
  ],
  "entities": [
    {
      "name": "Entity-oZIsMX6WgFs",
      "type": "domain_entity",
      "description": "Domain entity in oZIsMX6WgFs",
      "source_segment_ids": [
        "seg-000001"
      ]
    }
  ],
  "concepts": [
    {
      "name": "Concept-oZIsMX6WgFs",
      "type": "domain_concept",
      "description": "Domain concept in oZIsMX6WgFs",
      "source_segment_ids": [
        "seg-000001"
      ]
    }
  ],
  "open_questions": [],
  "contradictions_or_uncertainty": []
}